<?xml version="1.0" encoding="UTF-8"?>
<?xml-stylesheet type="text/xsl" href="employee.xsl"?>
<Company xmlns:xsi="http://www.w3.org/2001/XMLSchema-instance"
xsi:noNamespaceSchemaLocation="employee.xsd"> 
	
	   
		    <employee EMPID="Emp01">
		    <emp-name>Merin George</emp-name>
		<emp-age>35</emp-age>
		<emp-salary>90000</emp-salary>
		<emp-email>merinmg99@gmail.com</emp-email>
		<emp-phone>9847508465</emp-phone>
		<designation>Team Leader</designation>
		</employee>
		
	    <employee EMPID="eMP02">
		<emp-name>Ann Sherluck</emp-name>
		<emp-age>45</emp-age>
		<emp-salary>80000</emp-salary>
		<emp-email>merinmg99@gmail.com</emp-email>
		<emp-phone>9847508465</emp-phone>
		<designation>Team Leader</designation>
		</employee>
		
	    <employee EMPID="EMP03">
		<emp-name>Kevin George</emp-name>
		<emp-age>39</emp-age>
		<emp-salary>100000</emp-salary>
		<emp-email>merinmg99@gmail.com</emp-email>
		<emp-phone>9847508465</emp-phone>
		<designation>Team Leader</designation>
		</employee>
	
</Company>